{"activity":{"correlationId":"urn:uuid:9011eae0-f788-4717-a9a5-ef673d4d4800","name":"customer-address-change"},"actor":{"id":"contract-agent","type":"agent"},"binds":{"controlArtifactSignatureSha256":"0c5b2ecca9af82546c1808120f20cb5e60678327f7771f1015b551ea46e7174f"},"chain":{"prevSignatureSha256":"f873fd80f12de242dbb66f70e54dc812cfe883ed2b16348b11f0a9254dd3e970","seq":3},"createdAt":"2026-09-18T18:58:07Z","evidenceId":"urn:uuid:f9d94bcd-5a65-4d14-a2ce-e314a91921b0","objects":[{"contentType":"application/json","role":"approval-receipt","uri":"urn:uuid:8e8aff12-a2eb-40de-adbe-d8fab741a8a9"}],"schemaName":"AgentExecutionEvidence","schemaVersion":"1","step":{"approver":"urn:acme:user:41","decision":"approved","eventTime":"2026-09-18T18:58:07Z","type":"human_approval"}}