{"activity":{"correlationId":"urn:uuid:9011eae0-f788-4717-a9a5-ef673d4d4800","name":"customer-address-change"},"actor":{"id":"contract-agent","type":"agent"},"binds":{"controlArtifactSignatureSha256":"0c5b2ecca9af82546c1808120f20cb5e60678327f7771f1015b551ea46e7174f"},"chain":{"seq":0},"createdAt":"2026-09-18T18:58:05Z","evidenceId":"urn:uuid:3e425874-3104-4bda-9b2b-ab5ab1180ac4","objects":[],"schemaName":"AgentExecutionEvidence","schemaVersion":"1","step":{"eventTime":"2026-09-18T18:58:05Z","type":"run_start"}}