{"activity":{"correlationId":"urn:uuid:9011eae0-f788-4717-a9a5-ef673d4d4800","name":"customer-address-change"},"actor":{"id":"contract-agent","type":"agent"},"binds":{"controlArtifactSignatureSha256":"0c5b2ecca9af82546c1808120f20cb5e60678327f7771f1015b551ea46e7174f"},"chain":{"prevSignatureSha256":"3c705b954e0c624d2effa7d6a76cbc5e067a8e9de1f4dcd06086edcecc9394ea","seq":5},"createdAt":"2026-09-18T18:58:07Z","evidenceId":"urn:uuid:362a5f7f-613a-4475-ac5b-c3dca81cae33","objects":[{"contentType":"text/plain","role":"model-output","uri":"urn:uuid:3c1777c5-7ebf-444b-bafc-c9c2675d56e6"}],"schemaName":"AgentExecutionEvidence","schemaVersion":"1","step":{"eventTime":"2026-09-18T18:58:07Z","type":"model_output"}}