{"activity":{"correlationId":"urn:uuid:9011eae0-f788-4717-a9a5-ef673d4d4800","name":"customer-address-change"},"actor":{"id":"contract-agent","type":"agent"},"binds":{"controlArtifactSignatureSha256":"0c5b2ecca9af82546c1808120f20cb5e60678327f7771f1015b551ea46e7174f"},"chain":{"prevSignatureSha256":"27b5f0b7352fe71d45db0990d8fa7355e9273f043c4ca3040a3a648abef34955","seq":4},"createdAt":"2026-09-18T18:58:07Z","evidenceId":"urn:uuid:461f9dbb-ed2b-4147-b5a9-0532d1f80221","objects":[{"contentType":"application/json","role":"tool-result","uri":"urn:uuid:aa294911-4f3b-40dd-8ebe-efa09ed3f496"}],"schemaName":"AgentExecutionEvidence","schemaVersion":"1","step":{"eventTime":"2026-09-18T18:58:07Z","type":"tool_result"}}