{"activity":{"correlationId":"urn:uuid:9011eae0-f788-4717-a9a5-ef673d4d4800","name":"customer-address-change"},"actor":{"id":"contract-agent","type":"agent"},"binds":{"controlArtifactSignatureSha256":"0c5b2ecca9af82546c1808120f20cb5e60678327f7771f1015b551ea46e7174f"},"chain":{"prevSignatureSha256":"e16589ad7a05c53f527da2aeef4963db294bcd9bb44491781d637d69728088fa","seq":1},"createdAt":"2026-09-18T18:58:06Z","evidenceId":"urn:uuid:d602bb44-c4b3-420c-b160-8b8d656a57ce","objects":[{"contentType":"application/json","role":"tool-arguments","uri":"urn:uuid:8fef7fb8-1f13-4e64-86a6-e61b53af91ee"}],"schemaName":"AgentExecutionEvidence","schemaVersion":"1","step":{"eventTime":"2026-09-18T18:58:06Z","tool":{"name":"crm.update_customer","operation":"update"},"type":"tool_call"}}