{"activity":{"correlationId":"urn:uuid:9011eae0-f788-4717-a9a5-ef673d4d4800","name":"customer-address-change"},"actor":{"id":"contract-agent","type":"agent"},"binds":{"controlArtifactSignatureSha256":"0c5b2ecca9af82546c1808120f20cb5e60678327f7771f1015b551ea46e7174f"},"chain":{"prevSignatureSha256":"e7d6d8674428d54b35f93826d62c3d33a557b4d4491051318c6c99cc81191c74","seq":2},"createdAt":"2026-09-18T18:58:06Z","evidenceId":"urn:uuid:01c957cb-9d77-411e-9e41-46bac50037e2","objects":[],"schemaName":"AgentExecutionEvidence","schemaVersion":"1","step":{"decision":"allow_with_human_approval","eventTime":"2026-09-18T18:58:06Z","policyId":"customer-write-policy-v2","type":"authorization"}}