{"activity":{"correlationId":"urn:uuid:9011eae0-f788-4717-a9a5-ef673d4d4800","name":"customer-address-change"},"actor":{"id":"contract-agent","type":"agent"},"binds":{"controlArtifactSignatureSha256":"0c5b2ecca9af82546c1808120f20cb5e60678327f7771f1015b551ea46e7174f"},"chain":{"prevSignatureSha256":"634cebabc4b587d125e4f76d0f555fd284f30628182acb0c2184bdffd08962de","seq":6},"createdAt":"2026-09-18T18:58:08Z","evidenceId":"urn:uuid:5d63e646-db93-4a07-aaaa-14603188d0bf","objects":[],"schemaName":"AgentExecutionEvidence","schemaVersion":"1","step":{"eventTime":"2026-09-18T18:58:08Z","finalPrevSignatureSha256":"634cebabc4b587d125e4f76d0f555fd284f30628182acb0c2184bdffd08962de","finalSeq":6,"runDisposition":"completed","type":"run_end"}}